{
  "version": "0.2.0",
  "requirements_revision": "2026-10-09",
  "phases": {
    "phase-1": {
      "gate": {
        "all_of": [
          "primary-ai-phone-app",
          "github-mobile",
          "core-accounts",
          "instant-build"
        ]
      },
      "optional": [
        "phase-1-deployment-extra-credit"
      ]
    },
    "phase-2": {
      "gate": {
        "all_of": [
          "computer-setup",
          "private-progress-repository",
          "phase-2-remote-baseline",
          "quick-build",
          "live-deployment",
          "final-progress-save"
        ]
      },
      "optional": [
        "development-email",
        "progress-workbench",
        "workbench-publishing-extra-credit",
        "programmatic-harness"
      ]
    },
    "phase-3": {
      "preview": true
    }
  },
  "groups": {
    "core-account-services": {
      "title": "Core development accounts",
      "semantics": "all_of",
      "members": [
        "github",
        "cloudflare",
        "neon",
        "instant-builder"
      ]
    },
    "instant-builder-choice": {
      "title": "One instant builder",
      "semantics": "any_of",
      "members": [
        "google-ai-studio",
        "lovable",
        "replit",
        "base44"
      ]
    },
    "computer-baseline": {
      "title": "Computer and editor baseline",
      "semantics": "all_of",
      "members": [
        "selected-agentic-harness",
        "selected-ide",
        "system-cli-baseline",
        "cli-contexts"
      ]
    },
    "phase-2-remote-baseline": {
      "title": "Private network, file movement, and harness control",
      "semantics": "all_of",
      "members": [
        "tailscale-network",
        "phone-to-computer-file",
        "computer-to-phone-file",
        "verified-phone-connection"
      ]
    },
    "tailscale-devices-and-network": {
      "title": "Both devices and private network identity",
      "semantics": "all_of",
      "members": [
        "tailscale-computer",
        "tailscale-phone",
        "private-network-identity"
      ]
    }
  },
  "steps": {
    "get-started": {
      "title": "Start with your agent",
      "phase": "phase-1",
      "requirement": "recommended",
      "gate_for": [],
      "prerequisites": [],
      "evidence": [
        "learner_report",
        "agent_observation"
      ],
      "guide": "/agent/start.md",
      "completion_meaning": "The companion has begun or resumed from the learner's actual progress, with one useful next action."
    },
    "primary-ai-phone-app": {
      "title": "Your AI phone app",
      "phase": "phase-1",
      "requirement": "required",
      "gate_for": [
        "phase-1"
      ],
      "prerequisites": [],
      "evidence": [
        "learner_report"
      ],
      "guide": "/phases/1",
      "completion_meaning": "The selected primary AI phone companion app is signed in and can complete a useful chat interaction."
    },
    "github-mobile": {
      "title": "GitHub on your phone",
      "phase": "phase-1",
      "requirement": "required",
      "gate_for": [
        "phase-1"
      ],
      "prerequisites": [],
      "evidence": [
        "learner_report"
      ],
      "guide": "/phases/1",
      "completion_meaning": "GitHub Mobile is installed and signed in to the intended GitHub account."
    },
    "github": {
      "title": "GitHub account",
      "phase": "phase-1",
      "requirement": "required",
      "gate_for": [
        "phase-1"
      ],
      "prerequisites": [],
      "evidence": [
        "learner_report"
      ],
      "guide": "/phases/1",
      "internal": true,
      "completion_meaning": "The learner can sign in to the intended GitHub account; a working existing account counts."
    },
    "cloudflare": {
      "title": "Cloudflare account",
      "phase": "phase-1",
      "requirement": "required",
      "gate_for": [
        "phase-1"
      ],
      "prerequisites": [],
      "evidence": [
        "learner_report"
      ],
      "guide": "/phases/1",
      "internal": true,
      "completion_meaning": "The learner can sign in to the intended Cloudflare account; deployment is not required here."
    },
    "neon": {
      "title": "Neon account",
      "phase": "phase-1",
      "requirement": "required",
      "gate_for": [
        "phase-1"
      ],
      "prerequisites": [],
      "evidence": [
        "learner_report"
      ],
      "guide": "/phases/1",
      "internal": true,
      "completion_meaning": "The learner can sign in to the intended Neon account; an existing account or supported OAuth sign-in counts."
    },
    "instant-builder": {
      "title": "One instant builder",
      "phase": "phase-1",
      "requirement": "required",
      "gate_for": [
        "phase-1"
      ],
      "prerequisites": [],
      "completion": {
        "any_of": [
          "instant-builder-choice"
        ]
      },
      "evidence": [
        "learner_report"
      ],
      "guide": "/phases/1",
      "internal": true,
      "completion_meaning": "One selected instant builder is usable. A clear direct record of this chosen capability counts without fabricating which alternative was used or requiring the other builders.",
      "allow_recorded_completion": true
    },
    "google-ai-studio": {
      "title": "Google AI Studio",
      "phase": "phase-1",
      "requirement": "optional",
      "gate_for": [
        "phase-1"
      ],
      "prerequisites": [],
      "evidence": [
        "learner_report"
      ],
      "guide": "/recommendations",
      "internal": true,
      "completion_meaning": "If selected, Google AI Studio is signed in and ready to create the instant app; other builder alternatives are not required."
    },
    "lovable": {
      "title": "Lovable",
      "phase": "phase-1",
      "requirement": "optional",
      "gate_for": [
        "phase-1"
      ],
      "prerequisites": [],
      "evidence": [
        "learner_report"
      ],
      "guide": "/recommendations",
      "internal": true,
      "completion_meaning": "If selected, Lovable is signed in and ready to create the instant app; other builder alternatives are not required."
    },
    "replit": {
      "title": "Replit",
      "phase": "phase-1",
      "requirement": "optional",
      "gate_for": [
        "phase-1"
      ],
      "prerequisites": [],
      "evidence": [
        "learner_report"
      ],
      "guide": "/recommendations",
      "internal": true,
      "completion_meaning": "If selected, Replit is signed in and ready to create the instant app; other builder alternatives are not required."
    },
    "base44": {
      "title": "Base44",
      "phase": "phase-1",
      "requirement": "optional",
      "gate_for": [
        "phase-1"
      ],
      "prerequisites": [],
      "evidence": [
        "learner_report"
      ],
      "guide": "/recommendations",
      "internal": true,
      "completion_meaning": "If selected, Base44 is signed in and ready to create the instant app; other builder alternatives are not required."
    },
    "core-accounts": {
      "title": "Your development accounts",
      "phase": "phase-1",
      "requirement": "required",
      "gate_for": [
        "phase-1"
      ],
      "prerequisites": [],
      "completion": {
        "all_of": [
          "core-account-services"
        ]
      },
      "evidence": [
        "learner_report",
        "agent_check",
        "legacy_record"
      ],
      "guide": "/phases/1",
      "completion_meaning": "GitHub, Cloudflare, Neon and one instant builder are ready. A completed historical aggregate can count with its provenance without inventing missing child records; explicit contradictory evidence needs reconciliation.",
      "allow_recorded_completion": true
    },
    "instant-build": {
      "title": "Make one app that works",
      "phase": "phase-1",
      "requirement": "required",
      "gate_for": [
        "phase-1"
      ],
      "prerequisites": [
        "instant-builder"
      ],
      "evidence": [
        "learner_report",
        "agent_check"
      ],
      "guide": "/phases/1",
      "completion_meaning": "One instant app performs an observable intended behavior on the learner's phone. Source publication, a desktop, a private progress repository and deployment are not required."
    },
    "phase-1-deployment-extra-credit": {
      "title": "Publish your instant build (extra credit)",
      "phase": "phase-1",
      "requirement": "optional",
      "gate_for": [],
      "prerequisites": [
        "instant-build"
      ],
      "evidence": [
        "learner_report",
        "agent_check"
      ],
      "guide": "/setup/mobile-deployment.md",
      "completion_meaning": "If the learner chooses this extra credit, the instant app is published and its intended behavior is checked at the chosen public URL; declining does not block Phase 1."
    },
    "computer-setup": {
      "title": "Set up your computer",
      "phase": "phase-2",
      "requirement": "required",
      "gate_for": [
        "phase-2"
      ],
      "prerequisites": [],
      "completion": {
        "all_of": [
          "computer-baseline"
        ]
      },
      "evidence": [
        "agent_check",
        "learner_report"
      ],
      "guide": "/skills/computer-setup/current/SKILL.md",
      "completion_meaning": "All current-revision computer-baseline children are verified: selected harness, appropriate IDE, required system tools and command resolution in every intended context. A summary-only completion cannot waive a missing child."
    },
    "selected-agentic-harness": {
      "title": "Selected agentic harness",
      "phase": "phase-2",
      "requirement": "required",
      "gate_for": [
        "phase-2"
      ],
      "prerequisites": [],
      "evidence": [
        "agent_check"
      ],
      "guide": "/setup/ide.md",
      "internal": true,